{
  "schema_version": "release-receipt-v1",
  "status": "complete",
  "package_version": "1.2.3",
  "source_sha": "dddddddddddddddddddddddddddddddddddddddd",
  "package": {
    "destinations": [
      {
        "name": "forge",
        "endpoint": null,
        "outcome": "absent-by-host",
        "artifacts": []
      },
      {
        "name": "pypi",
        "endpoint": "https://upload.pypi.org/legacy/",
        "outcome": "published",
        "artifacts": [
          {
            "filename": "traefik_certificate_exporter-1.2.3-py3-none-any.whl",
            "sha256": "aaaaaaaaaaaaaaaaaaaaaaaaaaaaaaaaaaaaaaaaaaaaaaaaaaaaaaaaaaaaaaaa",
            "remote_sha256": "aaaaaaaaaaaaaaaaaaaaaaaaaaaaaaaaaaaaaaaaaaaaaaaaaaaaaaaaaaaaaaaa",
            "status": "published"
          },
          {
            "filename": "traefik_certificate_exporter-1.2.3.tar.gz",
            "sha256": "bbbbbbbbbbbbbbbbbbbbbbbbbbbbbbbbbbbbbbbbbbbbbbbbbbbbbbbbbbbbbbbb",
            "remote_sha256": "bbbbbbbbbbbbbbbbbbbbbbbbbbbbbbbbbbbbbbbbbbbbbbbbbbbbbbbbbbbbbbbb",
            "status": "published"
          }
        ]
      }
    ]
  },
  "oci": {
    "images": [
      {
        "name": "forge",
        "registry": "ghcr.io",
        "repository": "ravensorb/traefik-certificate-exporter",
        "digest": "sha256:cccccccccccccccccccccccccccccccccccccccccccccccccccccccccccccccc",
        "platforms": [
          "linux/amd64",
          "linux/arm64"
        ],
        "outcome": "published"
      },
      {
        "name": "dockerhub",
        "registry": "docker.io",
        "repository": "ravensorb/traefik-certificate-exporter",
        "digest": null,
        "platforms": [],
        "outcome": "disabled"
      }
    ]
  },
  "forge_release": {
    "id": "182736455",
    "url": "https://github.com/ravensorb/traefik-certificate-exporter/releases/tag/v1.2.3",
    "status": "published",
    "assets": [
      {
        "filename": "traefik_certificate_exporter-1.2.3-py3-none-any.whl",
        "sha256": "aaaaaaaaaaaaaaaaaaaaaaaaaaaaaaaaaaaaaaaaaaaaaaaaaaaaaaaaaaaaaaaa",
        "remote_sha256": "aaaaaaaaaaaaaaaaaaaaaaaaaaaaaaaaaaaaaaaaaaaaaaaaaaaaaaaaaaaaaaaa",
        "status": "published"
      },
      {
        "filename": "traefik_certificate_exporter-1.2.3.tar.gz",
        "sha256": "bbbbbbbbbbbbbbbbbbbbbbbbbbbbbbbbbbbbbbbbbbbbbbbbbbbbbbbbbbbbbbbb",
        "remote_sha256": "bbbbbbbbbbbbbbbbbbbbbbbbbbbbbbbbbbbbbbbbbbbbbbbbbbbbbbbbbbbbbbbb",
        "status": "published"
      },
      {
        "filename": "SHA256SUMS",
        "sha256": "eeeeeeeeeeeeeeeeeeeeeeeeeeeeeeeeeeeeeeeeeeeeeeeeeeeeeeeeeeeeeeee",
        "remote_sha256": "eeeeeeeeeeeeeeeeeeeeeeeeeeeeeeeeeeeeeeeeeeeeeeeeeeeeeeeeeeeeeeee",
        "status": "published"
      }
    ]
  },
  "reconciliation": {
    "oci_aliases": [
      {
        "alias": "latest",
        "expected_digest": "sha256:cccccccccccccccccccccccccccccccccccccccccccccccccccccccccccccccc",
        "actual_digest": "sha256:cccccccccccccccccccccccccccccccccccccccccccccccccccccccccccccccc",
        "status": "matched"
      }
    ],
    "git_aliases": [
      {
        "alias": "v1",
        "expected_sha": "dddddddddddddddddddddddddddddddddddddddd",
        "actual_sha": "dddddddddddddddddddddddddddddddddddddddd",
        "status": "matched"
      }
    ]
  },
  "failures": [],
  "run": {
    "server_url": "https://github.com",
    "repository": "ravensorb/traefik-certificate-exporter",
    "run_id": "1234567890",
    "run_attempt": 1
  }
}
